<?xml version="1.0" encoding="UTF-8"?>
<card xsi:noNamespaceSchemaLocation="../Card.xsd">
    <name>Oasis</name>
    <set>hinterlands</set>
    <type typeTemplate="action">Action</type>
    <cost>3</cost>
    <text>
        <line style="bold">+1 Card</line>
        <line style="bold">+1 Action</line>
        <line>+$1$</line>
        <line>Discard a card.</line>
    </text>
</card>
